charts/data/clean/corn_weather_clean.csv

year,corn_yield_bu_acre,june_precipitation,june_mean_temperature,may_sep_precipitation,trend_yield,yield_anomaly,rainfall_category
2000,140.0,3.23,66.39,14.834,144.9000000000001,-4.900000000000091,Normal
2001,133.0,6.103,67.61999999999999,13.794,146.7446640316207,-13.744664031620687,Wet
2002,153.0,4.252,71.17,18.756,148.58932806324128,4.4106719367587175,Normal
2003,140.0,5.063,65.88000000000001,16.33,150.43399209486188,-10.433992094861878,Normal
2004,160.0,5.382,64.02333333333334,20.714,152.27865612648247,7.721343873517526,Normal
2005,180.0,4.662,70.79333333333334,15.608,154.12332015810307,25.87667984189693,Normal
2006,165.0,2.2270000000000003,70.07666666666667,10.476,155.96798418972367,9.032015810276334,Dry
2007,150.0,2.2800000000000002,71.21333333333334,17.095,157.8126482213438,-7.812648221343807,Dry
2008,157.0,4.941,67.09,16.080000000000002,159.6573122529644,-2.6573122529644024,Normal
2009,174.0,3.932,66.37666666666667,14.184,161.501976284585,12.498023715415002,Normal
2010,168.6,9.464,68.27,27.847,163.3466403162056,5.2533596837944,Wet
2011,147.8,5.687,67.73,16.501,165.1913043478262,-17.39130434782618,Wet
2012,152.6,2.709,71.63000000000001,13.835,167.03596837944679,-14.435968379446791,Dry
2013,150.1,6.114,66.71333333333334,18.561,168.88063241106738,-18.780632411067387,Wet
2014,152.4,11.248,67.87666666666667,21.617,170.72529644268798,-18.32529644268797,Wet
2015,193.3,4.156,69.03666666666666,20.151,172.56996047430857,20.73003952569144,Normal
2016,203.5,3.677,71.23333333333333,19.605,174.41462450592917,29.08537549407083,Normal
2017,183.0,3.543,69.65666666666667,19.991,176.25928853754976,6.740711462450236,Normal
2018,179.9,6.065,71.52666666666667,22.504,178.10395256917036,1.7960474308296455,Wet
2019,172.2,2.7359999999999998,68.38333333333334,20.536,179.9486166007905,-7.748616600790513,Dry
2020,205.2,3.4890000000000003,73.75333333333333,16.242,181.7932806324111,23.40671936758889,Normal
2021,162.8,1.193,75.62333333333332,13.338,183.6379446640317,-20.83794466403168,Dry
2022,176.0,1.501,73.33666666666666,12.977,185.4826086956523,-9.482608695652289,Dry

README.md

### Worst Yield Years

- **2021:** -20.84 bushels per acre, with 1.193 inches of June rainfall (Dry).
- **2013:** -18.78 bushels per acre, with 6.114 inches of June rainfall (Wet).
- **2014:** -18.33 bushels per acre, with 11.248 inches of June rainfall (Wet).